mysql> use employeee;
Database changed
mysql> show tables;
Empty set (0.01 sec)

mysql> create table employee(SI_NO int(10) , Name varchar(20) , Designation varchar(30) ,Branch varchar(30));
Query OK, 0 rows affected, 1 warning (0.01 sec)

mysql> desc employee;
+-------------+-------------+------+-----+---------+-------+
| Field       | Type        | Null | Key | Default | Extra |
+-------------+-------------+------+-----+---------+-------+
| SI_NO       | int         | YES  |     | NULL    |       |
| Name        | varchar(20) | YES  |     | NULL    |       |
| Designation | varchar(30) | YES  |     | NULL    |       |
| Branch      | varchar(30) | YES  |     | NULL    |       |
+-------------+-------------+------+-----+---------+-------+
4 rows in set (0.00 sec)

mysql> alter table employee add Salary int(10);
Query OK, 0 rows affected, 1 warning (0.01 sec)
Records: 0  Duplicates: 0  Warnings: 1

mysql> desc employee;
+-------------+-------------+------+-----+---------+-------+
| Field       | Type        | Null | Key | Default | Extra |
+-------------+-------------+------+-----+---------+-------+
| SI_NO       | int         | YES  |     | NULL    |       |
| Name        | varchar(20) | YES  |     | NULL    |       |
| Designation | varchar(30) | YES  |     | NULL    |       |
| Branch      | varchar(30) | YES  |     | NULL    |       |
| Salary      | int         | YES  |     | NULL    |       |
+-------------+-------------+------+-----+---------+-------+
5 rows in set (0.00 sec)

mysql> insert into employee values(1,'Suresh','Manager','Chennai',25000);
Query OK, 1 row affected (0.00 sec)

mysql> insert into employee values(2,'Ramesh','Supervisor','Madurai',23000);
Query OK, 1 row affected (0.00 sec)

mysql> insert into employee values(3,'Hari','Assistant','Trichy',14000);
Query OK, 1 row affected (0.00 sec)

mysql> select * from  employee;
+-------+--------+-------------+---------+--------+
| SI_NO | Name   | Designation | Branch  | Salary |
+-------+--------+-------------+---------+--------+
|     1 | Suresh | Manager     | Chennai |  25000 |
|     2 | Ramesh | Supervisor  | Madurai |  23000 |
|     3 | Hari   | Assistant   | Trichy  |  14000 |
+-------+--------+-------------+---------+--------+
3 rows in set (0.00 sec)

mysql> rename employee to emp;
ERROR 1064 (42000): You have an error in your SQL syntax; check the manual that corresponds to your MySQL server version for the right syntax to use near 'employee to emp' at line 1
mysql> rename table employee to emp;
Query OK, 0 rows affected (0.01 sec)

mysql> select * from  emp;
+-------+--------+-------------+---------+--------+
| SI_NO | Name   | Designation | Branch  | Salary |
+-------+--------+-------------+---------+--------+
|     1 | Suresh | Manager     | Chennai |  25000 |
|     2 | Ramesh | Supervisor  | Madurai |  23000 |
|     3 | Hari   | Assistant   | Trichy  |  14000 |
+-------+--------+-------------+---------+--------+
3 rows in set (0.00 sec)

mysql> delete from emp where SI_NO=2;
Query OK, 1 row affected (0.00 sec)

mysql> select * from  emp;
+-------+--------+-------------+---------+--------+
| SI_NO | Name   | Designation | Branch  | Salary |
+-------+--------+-------------+---------+--------+
|     1 | Suresh | Manager     | Chennai |  25000 |
|     3 | Hari   | Assistant   | Trichy  |  14000 |
+-------+--------+-------------+---------+--------+
2 rows in set (0.00 sec)

mysql> drop table emp;
Query OK, 0 rows affected (0.01 sec)

mysql>
