mysql> use employeee;
Database changed
mysql> show tables;
Empty set (0.01 sec)

mysql> create table employee(SI_NO int(10) , Name varchar(20) , Designation varchar(30) ,Branch varchar(30));
Query OK, 0 rows affected, 1 warning (0.01 sec)

mysql> desc employee;
+-------------+-------------+------+-----+---------+-------+
| Field       | Type        | Null | Key | Default | Extra |
+-------------+-------------+------+-----+---------+-------+
| SI_NO       | int         | YES  |     | NULL    |       |
| Name        | varchar(20) | YES  |     | NULL    |       |
| Designation | varchar(30) | YES  |     | NULL    |       |
| Branch      | varchar(30) | YES  |     | NULL    |       |
+-------------+-------------+------+-----+---------+-------+
4 rows in set (0.00 sec)

mysql> alter table employee add Salary int(10);
Query OK, 0 rows affected, 1 warning (0.01 sec)
Records: 0  Duplicates: 0  Warnings: 1

mysql> desc employee;
+-------------+-------------+------+-----+---------+-------+
| Field       | Type        | Null | Key | Default | Extra |
+-------------+-------------+------+-----+---------+-------+
| SI_NO       | int         | YES  |     | NULL    |       |
| Name        | varchar(20) | YES  |     | NULL    |       |
| Designation | varchar(30) | YES  |     | NULL    |       |
| Branch      | varchar(30) | YES  |     | NULL    |       |
| Salary      | int         | YES  |     | NULL    |       |
+-------------+-------------+------+-----+---------+-------+
5 rows in set (0.00 sec)

mysql> insert into employee values(1,'Suresh','Manager','Chennai',25000);
Query OK, 1 row affected (0.00 sec)

mysql> insert into employee values(2,'Ramesh','Supervisor','Madurai',23000);
Query OK, 1 row affected (0.00 sec)

mysql> insert into employee values(3,'Hari','Assistant','Trichy',14000);
Query OK, 1 row affected (0.00 sec)

mysql> select * from  employee;
+-------+--------+-------------+---------+--------+
| SI_NO | Name   | Designation | Branch  | Salary |
+-------+--------+-------------+---------+--------+
|     1 | Suresh | Manager     | Chennai |  25000 |
|     2 | Ramesh | Supervisor  | Madurai |  23000 |
|     3 | Hari   | Assistant   | Trichy  |  14000 |
+-------+--------+-------------+---------+--------+
3 rows in set (0.00 sec)

mysql> rename employee to emp;
ERROR 1064 (42000): You have an error in your SQL syntax; check the manual that corresponds to your MySQL server version for the right syntax to use near 'employee to emp' at line 1
mysql> rename table employee to emp;
Query OK, 0 rows affected (0.01 sec)

mysql> select * from  emp;
+-------+--------+-------------+---------+--------+
| SI_NO | Name   | Designation | Branch  | Salary |
+-------+--------+-------------+---------+--------+
|     1 | Suresh | Manager     | Chennai |  25000 |
|     2 | Ramesh | Supervisor  | Madurai |  23000 |
|     3 | Hari   | Assistant   | Trichy  |  14000 |
+-------+--------+-------------+---------+--------+
3 rows in set (0.00 sec)

mysql> delete from emp where SI_NO=2;
Query OK, 1 row affected (0.00 sec)

mysql> select * from  emp;
+-------+--------+-------------+---------+--------+
| SI_NO | Name   | Designation | Branch  | Salary |
+-------+--------+-------------+---------+--------+
|     1 | Suresh | Manager     | Chennai |  25000 |
|     3 | Hari   | Assistant   | Trichy  |  14000 |
+-------+--------+-------------+---------+--------+
2 rows in set (0.00 sec)

mysql> drop table emp;
Query OK, 0 rows affected (0.01 sec)

mysql>


create database student;
Query OK, 1 row affected (0.01 sec)

mysql> use student;
Database changed
mysql> create table student(s_no int(10),name varchar(100),subject varchar(100),mark int(10));
Query OK, 0 rows affected, 2 warnings (0.03 sec)

mysql> insert into student values(1,"somu","os",75);
Query OK, 1 row affected (0.01 sec)

mysql> insert into student values(2,"sankar","dbms","66");
Query OK, 1 row affected (0.00 sec)

mysql> insert into student values(3,"mahesh","cloud",92);
Query OK, 1 row affected (0.00 sec)

mysql> alter table student
    -> add column grade varchar(100);
Query OK, 0 rows affected (0.03 sec)
Records: 0  Duplicates: 0  Warnings: 0

mysql> alter table student
    -> modify column name int(10);
ERROR 1366 (HY000): Incorrect integer value: 'somu' for column 'name' at row 1
mysql> alter table student
    -> modify column s_no varchar(100);
Query OK, 3 rows affected (0.05 sec)
Records: 3  Duplicates: 0  Warnings: 0

mysql> select*from student;
+------+--------+---------+------+-------+
| s_no | name   | subject | mark | grade |
+------+--------+---------+------+-------+
| 1    | somu   | os      |   75 | NULL  |
| 2    | sankar | dbms    |   66 | NULL  |
| 3    | mahesh | cloud   |   92 | NULL  |
+------+--------+---------+------+-------+
3 rows in set (0.00 sec)

mysql> delete from student
    -> where s_no=2;
Query OK, 1 row affected (0.00 sec)

mysql> select*from student;
+------+--------+---------+------+-------+
| s_no | name   | subject | mark | grade |
+------+--------+---------+------+-------+
| 1    | somu   | os      |   75 | NULL  |
| 3    | mahesh | cloud   |   92 | NULL  |
+------+--------+---------+------+-------+
2 rows in set (0.00 sec)

mysql> drop table student;
Query OK, 0 rows affected (0.02 sec)

mysql>
